[{"access_date":"2026-05-01","content_hash":"sha256:3e72304b056bb897b43aad81b6feef804f626d9bf2b9a60a6dc5738eff8b24e1","doc_id":"doc_sepsis_gl","edition":"5","extraction_manifest_id":"manifest_sepsis_gl","license_status":"permitted_research","publication_date":"2024-03-01","publisher":"日本集中治療医学会","society":"JSICM","source_type":"guideline","title_en":"Sepsis Management Guideline 2024","title_ja":"敗血症診療ガイドライン2024"},{"access_date":"2026-05-01","content_hash":"sha256:16ce5ebfe335a35dc21783ed4a000dac72507352b635508684c25c244b90b3b2","doc_id":"doc_allergy_ref","edition":"3","extraction_manifest_id":"manifest_allergy_ref","license_status":"permitted_research","publication_date":"2023-06-15","publisher":"日本アレルギー学会","society":"JSA","source_type":"reference","title_en":"Drug Allergy and Anaphylaxis Management Manual","title_ja":"薬物アレルギー・アナフィラキシー対応マニュアル"},{"access_date":"2026-05-01","content_hash":"sha256:428362bf600348ec0e7fb00da5eb5804e053c15f5b64d77b90a269166e2e243d","doc_id":"doc_vitals_protocol","edition":"1","extraction_manifest_id":"manifest_vitals_protocol","license_status":"permitted_research","publication_date":"2024-01-01","publisher":"日本集中治療医学会","society":"JSICM","source_type":"protocol","title_en":"Vital Sign Assessment Protocol","title_ja":"バイタルサイン評価プロトコル"}]