{"content_hash":"sha256:a0b1c2d3e4f5a0b1c2d3e4f5a0b1c2d3e4f5a0b1c2d3e4f5a0b1c2d3e4f5a0b1","doc_id":"doc_gl_sepsis_2024","edition":"2024","extraction_manifest_id":"manifest_gl_sepsis_2024","license_status":"permitted_research","publication_date":"2024-03-01","publisher":"日本集中治療医学会","society":"JSICM","source_type":"guideline","title_en":"Sepsis Management Guideline 2024","title_ja":"敗血症診療ガイドライン2024"}